{
  "schema_version": 1,
  "workflow_id": "personal-delaware-education-job-watch",
  "contract_version": "2026-10-14.2",
  "title": "Existing education job watch with bounded DOE source evidence",
  "domain": "personal",
  "owners": {
    "execution_owner_ref": "private:current-owner:personal-delaware-education-job-watch",
    "maintenance_owner_ref": "private:technical-maintainer"
  },
  "execution": {
    "executor_ref": "private:existing-executor:personal-delaware-education-job-watch",
    "account_refs": [
      "private:main-chatgpt",
      "private:job-watch-profile"
    ],
    "required_capabilities": [
      "approved-public-source-read",
      "local-python",
      "encrypted-private-state",
      "task-output-readback"
    ],
    "privacy_partition": "personal-private",
    "concurrency_key": "private:workflow-writer:personal-delaware-education-job-watch"
  },
  "trigger": {
    "kind": "existing_schedule",
    "schedule_ref": "Main ChatGPT::6ac29fe996ac81918b03a7d59354ef9f"
  },
  "sources": [
    {
      "source_ref": "private:doe-current-task-and-criteria",
      "required": true,
      "coverage": "complete",
      "max_age_seconds": 300
    },
    {
      "source_ref": "private:approved-doe-source-grant",
      "required": true,
      "coverage": "bounded",
      "max_age_seconds": 300
    },
    {
      "source_ref": "private:doe-prior-listing-history",
      "required": true,
      "coverage": "complete",
      "max_age_seconds": 300
    },
    {
      "source_ref": "private:district-and-charter-current-source-evidence",
      "required": true,
      "coverage": "bounded",
      "max_age_seconds": 300
    },
    {
      "source_ref": "private:task-specific-reported-vacancy-history",
      "required": true,
      "coverage": "complete",
      "max_age_seconds": 300
    }
  ],
  "outputs": [
    {
      "output_ref": "private:existing-doe-task-output",
      "kind": "report",
      "verification": "content_and_destination_readback"
    },
    {
      "output_ref": "private:doe-private-receipt",
      "kind": "receipt",
      "verification": "content_and_destination_readback"
    }
  ],
  "policy": {
    "allowed_actions": [
      "read-approved-doe-listings",
      "compare-exact-source-history",
      "save-job-review"
    ],
    "prohibited_actions": [
      "publish-externally",
      "send-messages",
      "change-live-schedules",
      "delete-source-history",
      "copy-private-content-to-core",
      "apply-for-jobs",
      "contact-employers",
      "infer-statewide-completeness",
      "reopen-paused-other-job-watch"
    ],
    "dependency_checks": [
      "Resolve private source, output, account and executor bindings; unresolved required bindings block dependent work.",
      "Verify current authorization, tested capabilities and one shared writer lease, including independent external sessions.",
      "Read exact source revisions and completeness; unavailable or partial sources never establish no work.",
      "Preserve prior complete state and reconcile uncertain output with its original request ID before any repeat write.",
      "Recovered native policy confirms the connected DOE worker plus continuing original district/charter searches; actual bridge and source access still need verification.",
      "Search current official employers across all Delaware districts and charter schools; DOE-only packet never establishes full requested coverage.",
      "Keep candidate qualifications and fit preferences in the private policy; preserve all inclusion, certification-pathway and exclusion criteria without inferring new credentials.",
      "Before detailed analysis, compare stable vacancy ID, official URL, posted/modified date and relevant fields with verified task-specific reported history.",
      "Skip unchanged listings only when prior detailed review/report is verified; source unchanged alone never means the candidate was reviewed or reported.",
      "Reassess new or materially changed listings and reuse verified pages within the run; missing history is a hold, never an empty prior history.",
      "First complete DOE source read seeds its source state; partial reads preserve fingerprints and unknown counts, never inferred vacancy closure.",
      "Use bounded cleanup and immutable source/readback; unknown cleanup or missing atomic artifact blocks refetch.",
      "Notify only meaningful new matches; no meaningful matches stays quiet only when required source and report-history coverage are complete."
    ],
    "uncertain_write_policy": "stop_and_reconcile"
  },
  "success_checks": [
    "Each strong new match includes employer/title, student population/contact, full-time/remote status, salary/scale, pension confidence, deadline, certification/pathway, qualifications, physical/on-site requirements and direct application link.",
    "Fit is grounded in verified private criteria and listing evidence; uncertain salary, pension or qualification facts remain explicit.",
    "Coverage distinguishes DOE and district/charter sources, with observation dates and prior-report comparisons; no false no-jobs claim from failed or partial sources.",
    "Only meaningful new or materially changed matches enter the existing destination; output readback and task-specific reported history remain distinct from retrieval.",
    "Record exact request, source revisions, output hash and native destination readback; label remaining coverage gaps."
  ],
  "failure": {
    "max_safe_read_retries": 1,
    "continue_independent_work": true,
    "report_next_step": true
  },
  "provenance": {
    "contract_refs": [
      "ai-ops/runbooks/doe-operator-check.md",
      "ai-ops/runtime/doe_worker.py",
      "ai-ops/workflow-contracts/routine-worker-contexts/doe-watch.md",
      "private:scheduler-registry-20261014",
      "ai-ops/workflow-contracts/non-school-contracts.md#personal-delaware-education-job-watch",
      "private:native-cloud-policy:personal-delaware-education-job-watch"
    ]
  }
}
